{
  "$schema": "https://json-schema.org/draft/2020-12/schema",
  "$id": "https://aicosmos.ai/schemas/lecture-doc/v1",
  "title": "LectureDoc v1",
  "description": "新一代讲义的内容协议。一门课 = 一个 LectureDoc；agent 只产出符合本 schema 的 JSON，渲染由 doc-to-deck 运行时完成。语义与创作规范见同目录 SPEC.md。",
  "type": "object",
  "required": ["schemaVersion", "id", "title", "language", "scenes"],
  "additionalProperties": false,
  "properties": {
    "schemaVersion": { "const": "1.0" },
    "id": { "type": "string", "pattern": "^[a-z0-9][a-z0-9-]*$" },
    "title": { "type": "string", "minLength": 1 },
    "subtitle": { "type": "string" },
    "language": { "type": "string", "examples": ["zh-CN", "en"] },
    "audience": { "type": "string" },
    "theme": { "type": "string", "default": "cartesian", "description": "视觉主题名。运行时据此加载设计系统；内容与主题解耦。" },
    "tutor": { "$ref": "#/$defs/tutor" },
    "scenes": { "type": "array", "minItems": 1, "items": { "$ref": "#/$defs/scene" } }
  },
  "$defs": {
    "inlineMd": {
      "type": "string",
      "description": "受限行内 markdown：**强调**(衬线斜体) / *强调* / `等宽` / $行内LaTeX$。禁止原始 HTML。"
    },
    "tutor": {
      "type": "object",
      "additionalProperties": false,
      "properties": {
        "suggestions": { "type": "array", "items": { "type": "string" }, "maxItems": 6 },
        "kb": {
          "type": "array",
          "items": {
            "type": "object",
            "required": ["pattern", "answer"],
            "additionalProperties": false,
            "properties": {
              "pattern": { "type": "string", "description": "JS 正则源码（不含定界符）" },
              "flags": { "type": "string", "pattern": "^[gimsuy]*$" },
              "answer": { "$ref": "#/$defs/inlineMd" }
            }
          }
        }
      }
    },
    "scene": {
      "type": "object",
      "required": ["id", "kind", "blocks", "notes"],
      "additionalProperties": false,
      "properties": {
        "id": { "type": "string", "pattern": "^[a-z0-9][a-z0-9-]*$" },
        "kind": { "enum": ["hero", "content", "quiz", "statement"] },
        "eyebrow": { "type": "string" },
        "headline": { "$ref": "#/$defs/inlineMd" },
        "headlineSize": { "type": "number", "minimum": 20, "maximum": 60 },
        "lead": { "$ref": "#/$defs/inlineMd" },
        "layout": {
          "type": "object",
          "additionalProperties": false,
          "properties": {
            "centered": { "type": "boolean", "description": "body 内容垂直居中" },
            "gap": { "type": "number", "minimum": 0, "maximum": 60 }
          }
        },
        "decor": {
          "type": "object",
          "additionalProperties": false,
          "properties": {
            "rings": {
              "type": "array",
              "maxItems": 2,
              "items": {
                "type": "object",
                "required": ["size"],
                "additionalProperties": false,
                "properties": {
                  "size": { "type": "number" },
                  "top": { "type": "number" }, "right": { "type": "number" },
                  "bottom": { "type": "number" }, "left": { "type": "number" }
                }
              }
            }
          }
        },
        "blocks": { "type": "array", "minItems": 1, "items": { "$ref": "#/$defs/block" } },
        "notes": { "type": "string", "minLength": 1, "description": "演讲者备注（详细讲解收纳处；正文保持克制）" }
      }
    },
    "block": {
      "type": "object",
      "required": ["type"],
      "properties": {
        "type": { "enum": ["hero", "statement", "list", "agenda", "callout", "formula", "flow", "table", "code", "compare", "quiz", "sim", "runnable", "embed", "freeform"] },
        "status": { "enum": ["ready", "pending", "error"], "default": "ready" },
        "fragment": { "type": "boolean", "description": "整块渐显" }
      },
      "allOf": [
        { "if": { "properties": { "type": { "const": "hero" } } }, "then": { "$ref": "#/$defs/heroBlock" } },
        { "if": { "properties": { "type": { "const": "statement" } } }, "then": { "$ref": "#/$defs/statementBlock" } },
        { "if": { "properties": { "type": { "const": "list" } } }, "then": { "$ref": "#/$defs/listBlock" } },
        { "if": { "properties": { "type": { "const": "agenda" } } }, "then": { "$ref": "#/$defs/agendaBlock" } },
        { "if": { "properties": { "type": { "const": "callout" } } }, "then": { "$ref": "#/$defs/calloutBlock" } },
        { "if": { "properties": { "type": { "const": "formula" } } }, "then": { "$ref": "#/$defs/formulaBlock" } },
        { "if": { "properties": { "type": { "const": "flow" } } }, "then": { "$ref": "#/$defs/flowBlock" } },
        { "if": { "properties": { "type": { "const": "table" } } }, "then": { "$ref": "#/$defs/tableBlock" } },
        { "if": { "properties": { "type": { "const": "code" } } }, "then": { "$ref": "#/$defs/codeBlock" } },
        { "if": { "properties": { "type": { "const": "compare" } } }, "then": { "$ref": "#/$defs/compareBlock" } },
        { "if": { "properties": { "type": { "const": "quiz" } } }, "then": { "$ref": "#/$defs/quizBlock" } },
        { "if": { "properties": { "type": { "const": "sim" } } }, "then": { "$ref": "#/$defs/simBlock" } },
        { "if": { "properties": { "type": { "const": "runnable" } } }, "then": { "$ref": "#/$defs/runnableBlock" } },
        { "if": { "properties": { "type": { "const": "embed" } } }, "then": { "$ref": "#/$defs/embedBlock" } },
        { "if": { "properties": { "type": { "const": "freeform" } } }, "then": { "$ref": "#/$defs/freeformBlock" } }
      ]
    },
    "heroBlock": {
      "required": ["title"],
      "properties": {
        "tag": { "type": "string" },
        "title": { "type": "array", "minItems": 1, "maxItems": 3, "items": { "type": "string" }, "description": "标题行数组，每项一行" },
        "titleSize": { "type": "number", "minimum": 28, "maximum": 80 },
        "sub": { "$ref": "#/$defs/inlineMd" },
        "facts": { "type": "string", "description": "一行纯文字元信息，用 · 分隔。禁止胶囊徽标。" },
        "accentRule": { "type": "boolean", "description": "标题下的一条黑色细线（全系统唯一纯黑线）" },
        "hint": { "type": "string" }
      }
    },
    "statementBlock": {
      "required": ["statement"],
      "properties": {
        "statement": { "$ref": "#/$defs/inlineMd" },
        "sub": { "$ref": "#/$defs/inlineMd" },
        "cite": { "type": "string" }
      }
    },
    "listBlock": {
      "required": ["items"],
      "properties": {
        "items": {
          "type": "array", "minItems": 1, "maxItems": 6,
          "items": {
            "type": "object", "required": ["text"], "additionalProperties": false,
            "properties": {
              "text": { "$ref": "#/$defs/inlineMd" },
              "fragment": { "type": "boolean" }
            }
          }
        }
      }
    },
    "agendaBlock": {
      "required": ["rows"],
      "properties": {
        "rows": {
          "type": "array", "minItems": 1, "maxItems": 6,
          "items": {
            "type": "object", "required": ["label", "text"], "additionalProperties": false,
            "properties": {
              "label": { "type": "string" },
              "text": { "$ref": "#/$defs/inlineMd" },
              "fragment": { "type": "boolean" }
            }
          }
        }
      }
    },
    "calloutBlock": {
      "required": ["label", "text"],
      "properties": {
        "label": { "type": "string" },
        "text": { "$ref": "#/$defs/inlineMd" },
        "latex": { "type": "string", "description": "可选：附在文字下方的展示公式（LaTeX）" },
        "latexSize": { "type": "number" }
      }
    },
    "formulaBlock": {
      "required": ["latex"],
      "properties": {
        "latex": { "type": "string" },
        "size": { "type": "number" },
        "caption": { "$ref": "#/$defs/inlineMd" }
      }
    },
    "flowBlock": {
      "required": ["nodes"],
      "properties": {
        "nodes": {
          "type": "array", "minItems": 2, "maxItems": 5,
          "items": {
            "type": "object", "required": ["title"], "additionalProperties": false,
            "properties": {
              "title": { "$ref": "#/$defs/inlineMd" },
              "sub": { "type": "string" },
              "state": { "enum": ["on", "q"], "description": "on=实线强调节点；q=虚线待解节点" }
            }
          }
        },
        "loopNote": { "type": "string", "description": "尾部循环注记，如 ↺ 循环至收敛" }
      }
    },
    "tableBlock": {
      "required": ["head", "rows"],
      "properties": {
        "head": { "type": "array", "minItems": 2, "items": { "type": "string" } },
        "rows": {
          "type": "array", "minItems": 1,
          "items": { "type": "array", "items": {
            "oneOf": [
              { "$ref": "#/$defs/inlineMd" },
              { "type": "object", "required": ["text"], "additionalProperties": false,
                "properties": { "text": { "$ref": "#/$defs/inlineMd" }, "hi": { "type": "boolean" } } }
            ]
          } }
        }
      }
    },
    "codeBlock": {
      "required": ["language", "source"],
      "properties": {
        "filename": { "type": "string" },
        "language": { "enum": ["python", "javascript", "text"] },
        "source": { "type": "string" },
        "caption": { "type": "string" }
      }
    },
    "compareBlock": {
      "required": ["left", "right"],
      "properties": {
        "left": { "$ref": "#/$defs/compareSide" },
        "right": { "$ref": "#/$defs/compareSide" }
      }
    },
    "compareSide": {
      "type": "object", "required": ["block"], "additionalProperties": false,
      "properties": {
        "caption": { "type": "string" },
        "block": { "$ref": "#/$defs/block" }
      }
    },
    "quizBlock": {
      "required": ["kind"],
      "properties": {
        "kind": { "enum": ["objective", "subjective"] },
        "context": { "$ref": "#/$defs/inlineMd", "description": "选项上方的一行铺垫（可含行内公式）" },
        "choices": {
          "type": "array", "minItems": 2, "maxItems": 6,
          "items": {
            "type": "object", "required": ["key", "text"], "additionalProperties": false,
            "properties": { "key": { "type": "string", "pattern": "^[a-z]$" }, "text": { "$ref": "#/$defs/inlineMd" } }
          }
        },
        "answer": { "type": "string", "pattern": "^[a-z]$" },
        "explain": { "$ref": "#/$defs/inlineMd" },
        "prompt": { "$ref": "#/$defs/inlineMd", "description": "主观题题干" },
        "angles": { "type": "array", "items": { "type": "string" }, "description": "主观题可选切入角度" },
        "instruction": { "$ref": "#/$defs/inlineMd", "description": "主观题作答/提交要求" }
      },
      "allOf": [
        { "if": { "properties": { "kind": { "const": "objective" } } },
          "then": { "required": ["kind", "choices", "answer", "explain"] } },
        { "if": { "properties": { "kind": { "const": "subjective" } } },
          "then": { "required": ["kind", "prompt"] } }
      ]
    },
    "simParam": {
      "type": "object", "required": ["name", "label", "min", "max", "step", "default"],
      "additionalProperties": false,
      "properties": {
        "name": { "type": "string", "pattern": "^[a-zA-Z_][a-zA-Z0-9_]*$" },
        "label": { "type": "string" },
        "min": { "type": "number" }, "max": { "type": "number" },
        "step": { "type": "number" }, "default": { "type": "number" },
        "decimals": { "type": "integer", "minimum": 0, "maximum": 4 }
      }
    },
    "simBlock": {
      "required": ["engine", "params"],
      "properties": {
        "engine": { "enum": ["dynamics1d", "searchCompare", "custom"] },
        "params": { "type": "array", "minItems": 1, "maxItems": 4, "items": { "$ref": "#/$defs/simParam" } },
        "reseedLabel": { "type": "string", "description": "换随机种子按钮文字；缺省则不显示按钮" },
        "model": { "type": "object", "description": "引擎专属模型定义，见 SPEC.md 各引擎小节" },
        "regimes": {
          "type": "array",
          "items": {
            "type": "object", "required": ["when", "label", "desc"], "additionalProperties": false,
            "properties": {
              "when": { "type": "string", "description": "受限布尔表达式（参数白名单）；按序取第一个为真者" },
              "label": { "type": "string" }, "desc": { "type": "string" },
              "tone": { "enum": ["line", "accent", "ink"] },
              "dash": { "type": "string", "description": "solid 或 SVG dash 数组如 6,3" }
            }
          }
        },
        "noiseNote": {
          "type": "object", "required": ["when", "text"], "additionalProperties": false,
          "properties": { "when": { "type": "string" }, "text": { "type": "string" } }
        },
        "sidecar": {
          "type": "object", "additionalProperties": false,
          "properties": { "code": { "$ref": "#/$defs/codeBlock" } },
          "description": "面板里随附的说明物（如更新规则代码卡）"
        },
        "legend": { "type": "string" },
        "labels": { "type": "object", "additionalProperties": { "type": "string" } },
        "chart": { "type": "object", "description": "坐标轴标签/目标线等图表规格，见 SPEC.md" },
        "computeJs": { "type": "string", "description": "仅 engine=custom：沙箱 JS 纯函数源码，契约见 SPEC.md" }
      },
      "allOf": [
        { "if": { "properties": { "engine": { "const": "custom" } } }, "then": { "required": ["engine", "params", "computeJs", "chart"] } },
        { "if": { "properties": { "engine": { "const": "dynamics1d" } } }, "then": { "required": ["engine", "params", "model"] } },
        { "if": { "properties": { "engine": { "const": "searchCompare" } } }, "then": { "required": ["engine", "params", "model"] } }
      ]
    },
    "runnableBlock": {
      "required": ["languages", "starter", "env"],
      "properties": {
        "languages": { "type": "array", "minItems": 1, "items": { "enum": ["python", "js"] } },
        "starter": {
          "type": "object", "additionalProperties": false,
          "properties": { "python": { "type": "string" }, "js": { "type": "string" } }
        },
        "env": {
          "type": "object", "required": ["kind"],
          "properties": {
            "kind": { "enum": ["objective1d", "custom"] },
            "objective": { "type": "string" },
            "domain": { "type": "array", "items": { "type": "number" }, "minItems": 2, "maxItems": 2 },
            "yDomain": { "type": "array", "items": { "type": "number" }, "minItems": 2, "maxItems": 2 },
            "candidates": { "type": "integer", "minimum": 10, "maximum": 2000 },
            "pythonPreamble": { "type": "string", "description": "仅 kind=custom" },
            "jsPreamble": { "type": "string", "description": "仅 kind=custom：求值后须返回 helper 对象的 JS 表达式" }
          }
        },
        "hint": { "type": "string" },
        "consoleHint": { "type": "string" }
      }
    },
    "embedBlock": {
      "description": "保留位：嵌入后端产品（代码实验室/互动视频/互动实验室）。运行时当前仅渲染占位框。",
      "required": ["product"],
      "properties": {
        "product": { "enum": ["codelab", "video", "sim"] },
        "launch": { "type": "object" },
        "artifact": {
          "type": "object",
          "properties": {
            "sessionId": { "type": "string" }, "toolCallId": { "type": "string" },
            "url": { "type": "string" }, "needsOpen": { "type": "boolean" },
            "status": { "enum": ["pending", "ready", "failed"] }
          }
        },
        "fallbackPoster": { "type": "string" }
      }
    },
    "freeformBlock": {
      "description": "逃生舱：当 14 种正式 block 类型都无法表达所需版式/内容形态时的最后手段。永远以显眼的\"未分类内容\"样式渲染，绝不悄悄融入正常排版——这是有意的摩擦，用来抑制滥用，也让高频出现的 rationale 成为未来 schema 长出新正式 block 类型的信号。html 会被运行时按白名单标签/属性净化（禁 script/style/iframe/object/embed/内联事件处理器/javascript: 协议），不是可信任意 HTML 的通道。",
      "required": ["html", "rationale"],
      "properties": {
        "html": { "type": "string", "minLength": 1, "description": "结构化 HTML 片段（非完整文档）；运行时净化后原样渲染。" },
        "rationale": { "type": "string", "minLength": 10, "description": "必须具体说明现有 14 种正式类型分别为何不适用，而不是泛泛的\"需要自定义排版\"。" }
      }
    }
  }
}
