{
  "schemaVersion": "1.0",
  "id": "REPLACE-kebab-id",
  "title": "REPLACE 课程标题",
  "subtitle": "REPLACE 副标题（可选）",
  "language": "zh-CN",
  "audience": "REPLACE 受众（如：本科生 / 研究员）",
  "theme": "cartesian",
  "tutor": {
    "suggestions": ["REPLACE 建议问题 1", "REPLACE 建议问题 2"],
    "kb": [
      { "pattern": "关键词|同义词", "answer": "REPLACE 该问题的本地应答（可含 **强调** 与 $公式$）" }
    ]
  },
  "scenes": [
    {
      "id": "cover",
      "kind": "hero",
      "notes": "REPLACE 封面备注（讲者稿，可详细）",
      "blocks": [
        { "id": "cover-hero", "type": "hero", "status": "pending" }
      ]
    },
    {
      "id": "REPLACE-scene-id",
      "kind": "content",
      "eyebrow": "REPLACE 小节标签",
      "headline": "REPLACE 页标题",
      "lead": "REPLACE 一句陈述式导语",
      "notes": "REPLACE 讲者备注",
      "blocks": [
        { "id": "b1", "type": "list", "status": "pending" },
        { "id": "b2", "type": "sim", "status": "pending" }
      ]
    }
  ]
}
